{
  "namespace": "https://id.example.com/org/acme",
  "agentId": "agt_01JABCDEF0000000000000000",
  "agentClass": "service",
  "authorityBindingRef": "ab_01",
  "agentState": "active",
  "agentEpoch": 4, "identityEpoch": 4,
  "createdAt": "2026-09-22T10:00:00Z",
  "updatedAt": "2026-09-22T10:05:00Z"
}
